product_id,title,universe,image_url,bullet_points,min_rank_search,avg_rank_search,min_rank_category,avg_rank_category,retailer_category_node,retailer_brand_name,description_filled
B09BPZPNF4,"WATERFAST Keto Electrolyte Powder for Fasting and Hydration - Lemon Lime Flavor | Pink Himalayan Salt (Sodium), Potassium, Magnesium, Calcium | Sugar Free, Gluten Free, Soy Free",beverages,"[""https://storage.googleapis.com/ef-prod-gather-v2/storage/Amazon-US/resources/detail/2025/05/a7297cef630999fc3e413f814968739c.res"",""https://storage.googleapis.com/ef-prod-gather-v2/storage/Amazon-US/resources/detail/2025/05/807862f565ea595645749f1528e6a0e3.res"",""https://storage.googleapis.com/ef-prod-gather-v2/storage/Amazon-US/resources/detail/2025/05/cbf44631d658a202be53ba72addb0568.res"",""https://storage.googleapis.com/ef-prod-gather-v2/storage/Amazon-US/resources/detail/2025/05/c07a170fe3de4d1c584607aef7dfc1e2.res"",""https://storage.googleapis.com/ef-prod-gather-v2/storage/Amazon-US/resources/detail/2025/05/c67913c72b435f45dbe8a55781c3fecf.res"",""https://storage.googleapis.com/ef-prod-gather-v2/storage/Amazon-US/resources/detail/2025/05/84e3f7e3d0dfd931e39a7a41adcc4bc8.res""]","[""SPECIALLY FORMULATED FOR LONG TERM FASTING: Key electrolytes in the correct proportions allow the body to remain active and alert during fasting periods. Formulated according to guidelines from US/CA recommended daily values (with fasting in mind) to help you succeed in your fast while being KETO-friendly and contains zero sugar."",""SUCCESSFUL FASTING WITH TASTY MEAL: Natural flavors and stevia eases the fasting process by making the drink taste like a meal and more palatable to drink. The great taste of lemon & lime helps you consume more water which is vital during a fast and makes the fasting process more enjoyable. Enjoy this delightful drink and continue to be active while fasting."",""HIGH QUALITY INGREDIENTS: Pink Himalayan Sea salt, potassium chloride, magnesium citrate, and calcium citrate are all high-quality ingredients and common supplements found in capsules or powders taken by people across the world. These widely used ingredients offer better absorption and reduce the likelihood of side effects."",""SUGGESTED ROUTINE: A 3 day fast followed by 2 days of refeeding is recommended for optimal results. A shorter 1-2 day fast will not require refeeding. Refeeding allows the body to slowly come back from a fasting state and continues the weight loss for a couple more days. Drinking bone broth after a long fast will replenish the body with rich nutrients, good fats, and collagen."",""100% USA MADE: 1000mg of Sodium, 1000mg of Potassium, 100mg of Magnesium, and 420mg of Calcium per Serving and tested to be gluten-free and soy-free""]",30,35,12,12,Health & Household › Diet & Sports Nutrition › Sports Nutrition › Electrolyte Replacements,Simply Primal,"WATERFAST Keto Electrolyte Powder for Fasting and Hydration Lemon Lime Flavor Pink Himalayan Salt Sodium Potassium by Simply Primal is designed for everyday use in the Health & Household segment. It features 100% USA MADE: 1000mg of Sodium, 1000mg of Potassium, 100mg of Magnesium, and 420mg of Calcium per Serving and tested to be gluten-free and soy-free. Suitable for home or on-the-go use; review the product images and information for full specifications and usage guidance."
B0B992G9VK,"Electrolyte Powder Drink Mix, 25 Count, Travel Ready Stick Packs, Extreme Re-Hydration, Low Sugar, Prevent Dehydration, Eliminate Cramps (Lemon-Lime)",snacks & sweets,"[""https://storage.googleapis.com/ef-prod-gather-v2/storage/Amazon-US/resources/detail/2025/06/5a57a96b495979d34b8e12fd8dc496e7.res"",""https://storage.googleapis.com/ef-prod-gather-v2/storage/Amazon-US/resources/detail/2025/06/8deb1fb020aed6b06b10a76f5e263ba5.res"",""https://storage.googleapis.com/ef-prod-gather-v2/storage/Amazon-US/resources/detail/2025/06/aa4e24a272a906b6db68b2bc3087320a.res"",""https://storage.googleapis.com/ef-prod-gather-v2/storage/Amazon-US/resources/detail/2025/06/a4512ee207ee2c771e428c13652998cf.res"",""https://storage.googleapis.com/ef-prod-gather-v2/storage/Amazon-US/resources/detail/2025/06/34bb7ee11998fefd1a2d2e6dcafd0c4f.res"",""https://storage.googleapis.com/ef-prod-gather-v2/storage/Amazon-US/resources/detail/2025/06/afd421765aafee8b324084912c20320b.res"",""https://storage.googleapis.com/ef-prod-gather-v2/storage/Amazon-US/resources/detail/2025/06/ea8dea2ab9b2964ed8c4a01c30d9bb36.res""]","[""✅ RAPID HYDRATION Tactical is an electrolyte replacement mix that helps you hydrate better than anything else. It replaces minerals that are lost in sweat, without excess sugar or any added junk. It is a must have for firefighters, construction workers, solar farms, oil fields, or anyone working hard under heat stress"",""✅ ELIMINATE CRAMPS Designed by professionals from real science, Tactical is a no-nonsense way of preventing cramps and fighting dehydration during long, hot days on the job. With 300mg Sodium, 100mg Potassium, 16mg Magnesium, and 32mg Calcium to replenish what you lose through sweat!"",""✅ MIXES EASILY IN WATER Simply add 1 packet to any 16oz water bottle, shake until dissolved"",""✅ MADE IN USA Our ingredients are all US sourced and inspected for purity. Our mixing and packaging takes place in a GMP inspected and approved facility in Los Angeles, California"",""✅ FIVE FRUITY FLAVORS Choose your favorite or try them all in our variety pack""]",,,,,Health & Household › Diet & Sports Nutrition › Sports Nutrition › Electrolyte Replacements,Fluid Tactical,"Electrolyte Powder Drink Mix 25 Count Travel Ready Stick Packs Extreme Re-Hydration Low Sugar Prevent Dehydration by Fluid Tactical is designed for everyday use in the Health & Household segment. Key details include ✅ MIXES EASILY IN WATER Simply add 1 packet to any 16oz water bottle, shake until dissolved and ✅ FIVE FRUITY FLAVORS Choose your favorite or try them all in our variety pack. Suitable for home or on-the-go use; review the product images and information for full specifications and us"
B07DGKSF1P,"SALTT Hydrate Electrolyte Drops - Keto Diets - Intermittent Fasting - Immune Support - Gluten & Sugar Free - Paleo - Sodium, Magnesium, Potassium & Trace Minerals - Unflavored - 8.3 fl oz",snacks & sweets,"[""https://storage.googleapis.com/ef-prod-gather-v2/storage/Amazon-US/resources/detail/2025/07/ae1b73127943cb260f81284c16a3634e.res"",""https://storage.googleapis.com/ef-prod-gather-v2/storage/Amazon-US/resources/detail/2025/07/ccbd0312a90c5bdef9412f7bbfc4ff6b.res"",""https://storage.googleapis.com/ef-prod-gather-v2/storage/Amazon-US/resources/detail/2025/07/2bb9f664e13e115a4b19d834c033fc51.res"",""https://storage.googleapis.com/ef-prod-gather-v2/storage/Amazon-US/resources/detail/2025/07/9e7071a75d9a3f7d66439b0eeed5e91e.res"",""https://storage.googleapis.com/ef-prod-gather-v2/storage/Amazon-US/resources/detail/2025/07/043c3d962fb9fc3a36a21330e3ea2e15.res"",""https://storage.googleapis.com/ef-prod-gather-v2/storage/Amazon-US/resources/detail/2025/07/fea792af6cca1d13dc491c5fca2365d4.res"",""https://storage.googleapis.com/ef-prod-gather-v2/storage/Amazon-US/resources/detail/2025/07/dc79378f53711f736d483f4a139bb755.res"",""https://storage.googleapis.com/ef-prod-gather-v2/storage/Amazon-US/resources/detail/2025/07/308bf6647707a5f51cf6b7a8a5ecbea5.res"",""https://storage.googleapis.com/ef-prod-gather-v2/storage/Amazon-US/resources/detail/2025/07/cc5c8f95fd7635e949e23bdf9e0aed5e.res""]","[""Pure, Natural Hydration: SALTT Hydrate Electrolyte Drops are sourced from the Great Salt Lake and provide a bioavailable blend of vital electrolytes and trace minerals for hydration on the go, at the gym, work, travel, or outdoor activities."",""SALTT Hydrate Electrolyte Drops are perfect for your busy lifestyle! Our electrolyte drops come in 4 convenient sizes. Take them on the go with our 2 oz. Squeeze Bottle, 4 oz Dropper Bottle, 8.3 oz or 18.6 oz Refill Bottles."",""Our rigorously tested electrolyte blend supports health and vitality during diets and fasting. Pure formula, free from artificial ingredients, colors, caffeine, or dyes. Easily mix in coffee, water, or tea."",""Doctor-Approved Electrolyte Blend: Provides 265mg of Potassium, 255mg of Sodium, and 90mg of Potassium"",""Formerly Keto Chow Electrolyte Drops, SALTT Hydrate Electrolyte Drops are the same formula with a snazzy new look.""]",38,52,1,1,Health & Household › Diet & Sports Nutrition › Sports Nutrition › Electrolyte Replacements,Keto Chow,"SALTT Hydrate Electrolyte Drops Keto Diets Intermittent Fasting Immune Support Gluten Sugar Free Paleo Sodium Magnesium by Keto Chow is designed for everyday use in the Health & Household segment. Key details include Doctor-Approved Electrolyte Blend: Provides 265mg of Potassium, 255mg of Sodium, and 90mg of Potassium and Formerly Keto Chow Electrolyte Drops, SALTT Hydrate Electrolyte Drops are the same formula with a snazzy new look. Suitable for home or on-the-go use; review the product images"
B094DW21L4,The Gatorade Gatorade Thirst Quencher Powder 1 23oz Packets Makes 20 ounces 10 Pack Orange 1 23 Ounce Pack of 10,beverages,"[""https://storage.googleapis.com/ef-prod-gather-v2/storage/Amazon-US/resources/detail/2025/05/6320fcd3bd833412cf4990cbed6b5441.res"",""https://storage.googleapis.com/ef-prod-gather-v2/storage/Amazon-US/resources/detail/2025/05/ae9625d9a877a2b743b956b8f7b971f0.res"",""https://storage.googleapis.com/ef-prod-gather-v2/storage/Amazon-US/resources/detail/2025/05/969c983b4e5361304488c2ae026fe07f.res"",""https://storage.googleapis.com/ef-prod-gather-v2/storage/Amazon-US/resources/detail/2025/05/c07f39e46cc61504ad48b6b2816565cb.res"",""https://storage.googleapis.com/ef-prod-gather-v2/storage/Amazon-US/resources/detail/2025/05/d2aef4275a27cdb83c275b7c039542d4.res"",""https://storage.googleapis.com/ef-prod-gather-v2/storage/Amazon-US/resources/detail/2025/05/9f5ff0ac4bb8a3684eab4ee8ba022a77.res"",""https://storage.googleapis.com/ef-prod-gather-v2/storage/Amazon-US/resources/detail/2025/05/5fe4dae84e83da6e13b09dadd8638269.res"",""https://storage.googleapis.com/ef-prod-gather-v2/storage/Amazon-US/resources/detail/2025/05/1ce19560db84dbd3133f2a24d3aaa6c9.res"",""https://storage.googleapis.com/ef-prod-gather-v2/storage/Amazon-US/resources/detail/2025/05/af2606dadb61c112d04a4b2288f9f7f5.res""]",[],48,48,,,,Poiget,"This Thirst Quencher Orange Flavor Powder Mix (10 Packs) is your go-to hydration solution for peak performance during and after intense workouts. Each convenient packet mixes effortlessly with water, creating a refreshing 16.9 fl oz serving of this iconic orange flavor. Packed with essential sodium and potassium, this sports drink powder is formulated to help replace the electrolytes lost through sweat during prolonged or high-intensity exercises, ensuring you stay at your best. What's more, it provides essential carbohydrate energy to refuel your hardworking muscles. Whether you're a dedicated athlete or simply looking for a reliable way to rehydrate, Thirst Quencher Orange Flavor Powder Mix has got you covered. Stay at the top of your game with this easy-mix, electrolyte-replenishing, and delicious drink mix – the ultimate choice for fitness enthusiasts and active individuals. This Thirst Quencher Orange Flavor Powder Mix (10 Packs) is your go-to hydration solution for peak performance during and after intense workouts. Each convenient packet mixes effortlessly with water, creating a refreshing 16.9 fl oz serving of this iconic orange flavor. Packed with essential sodium and potassium, this sports drink powder is formulated to help replace the electrolytes lost through sweat during prolonged or high-intensity exercises, ensuring you stay at your best. What's more, it provides essential carbohydrate energy to refuel your hardworking muscles. Whether you're a dedicated athlete or simply looking for a reliable way to rehydrate, Thirst Quencher Orange Flavor Powder Mix has got you covered. Stay at the top of your game with this easy-mix, electrolyte-replenishing, and delicious drink mix – the ultimate choice for fitness enthusiasts and active individuals."
B09F86XSQT,Stur Electrolyte Hydration Powder | Fruit Punch | High Antioxidants & B Vitamins | Sugar Free | Non-GMO | Daily Hydration & Workout Recovery | Keto | Paleo | Vegan (16 Packets),snacks & sweets,"[""https://storage.googleapis.com/ef-prod-gather-v2/storage/Amazon-US/resources/detail/2025/08/2faa25b9b45c2f5c49c251c4911e8956.res"",""https://storage.googleapis.com/ef-prod-gather-v2/storage/Amazon-US/resources/detail/2025/08/d87cdd059b4267bfa1e80f3a7006a158.res"",""https://storage.googleapis.com/ef-prod-gather-v2/storage/Amazon-US/resources/detail/2025/08/6b7880f529a1a9ed06f2b32c22a2cd1b.res"",""https://storage.googleapis.com/ef-prod-gather-v2/storage/Amazon-US/resources/detail/2025/08/d60d13600cfe7819b8137301947137cf.res"",""https://storage.googleapis.com/ef-prod-gather-v2/storage/Amazon-US/resources/detail/2025/08/f17bd88bb3b0abfb8093171ce7d152c2.res""]","[""HYDRATES BETTER THAN WATER - Helps you hydrate quickly and naturally. Our electrolyte powder is packed with Antioxidants & B Vitamins. Zero sugar, non-GMO, no artificial ingredients or sweeteners."",""2X THE POTASSIUM OF LEADING SPORTS DRINKS - Stur Hydration is packed with potassium, more than double the leading sports drink!"",""HIGH ANTIOXIDANTS & B VITAMINS - Our clean electrolyte hydration powder delivers 150% of your daily recommended Vitamin C to boost immunity and 100% of your daily value for vitamins B1, B3, B5, and B6!"",""DAILY WELLNESS & WORKOUT RECOVERY - Most Americans suffer from chronic dehydration. Our electrolyte powder replenishes your body and fights off headaches, dizziness, muscle fatigue, muscle cramping and fuzzy thinking."",""SATISFACTION GUARANTEE - If you are not totally satisfied, just message us directly and we will refund your order. Stur was created by a father to help his family to love water naturally. What're you waiting for?! Trying Stur is risk-free!""]",,,,,Health & Household › Diet & Sports Nutrition › Sports Nutrition › Electrolyte Replacements,Stur,"Stur Electrolyte Hydration Powder Fruit Punch High Antioxidants B Vitamins Sugar Free Non-GMO Daily Hydration Workout is designed for everyday use in the Health & Household segment. It features 2X THE POTASSIUM OF LEADING SPORTS DRINKS - Stur Hydration is packed with potassium, more than double the leading sports drink!. Suitable for home or on-the-go use; review the product images and information for full specifications and usage guidance."
B0D7YPD8WV,Liquid Hydration Multiplier Firecraker Flavor 30 Pack | Hydration Powder Packets | Electrolyte Drink Mix | Easy Open Single-Serving Sticks | Non-GMO |,snacks & sweets,"[""https://storage.googleapis.com/ef-prod-gather-v2/storage/Amazon-US/resources/detail/2025/07/643e2cebf83553e122c2b904bded0b90.res"",""https://storage.googleapis.com/ef-prod-gather-v2/storage/Amazon-US/resources/detail/2025/07/14f1a5fad85ad9934021ea459a93250b.res""]","[""30 Pack of Liquid Hydration Multiplier Firecraker flavor."",""Liquid Hydration Multiplier is a great-tasting, Non-GMO electrolyte drink mix powered by Cellular Transport Technology to hydrate faster and more efficiently than water alone."",""Each stick contains 3x the electrolytes of traditional sports drinks with 5 essential vitamins: B3, B5, B6, B12 and vitamin C. No Artificial Sweeteners, Flavors, Colors or Preservatives"",""Enjoy convenient, on-the-go hydration and immune support with Hydration Multiplier+ Immune Support. Pour one easy-to-open stick packet into 16oz of water, mix or shake, and hydrate.""]",,,3,3,Health & Household › Diet & Sports Nutrition › Sports Nutrition › Electrolyte Replacements,,"Liquid Hydration Multiplier - Hydrate 2x faster than water alone with Hydration Multiplier, a great-tasting electrolyte drink powder with five essential vitamins and 3x the electrolytes of traditional sports drinks. Whether you are in need of hydration for exercise, travel, or long nights, Hydration Multiplier packets have you covered. Hydration Multiplier helps provide faster, more efficient hydration. Non-GMO and made with premium ingredients - Hydration Multiplier Electrolyte Powder Drink Mix is made with natural flavors and has no artificial colors or sweeteners. Every serving contains 5 essential vitamins: vitamins B3, B5, B6, B12 and vitamin C. It's also gluten-free, soy-free, and dairy-free. On-the-go hydration - Enjoy convenient, on-the-go hydration with Hydration Multiplier. These single-serving, travel-friendly stick packets are perfect for taking to the gym, sports games, and long flights. Pour one easy-to-open stick packet into 16oz of water, mix or shake, and hydrate.This bag includes 30 single-serve packets of Firecraker flavor."
B0BPN423GH,"Gatorlyte Rapid Rehydration Electrolyte Beverage, Variety Pack, Lower Sugar, Specialized Blend of 5 Electrolytes, No Artificial Sweeteners or Flavors, 18 pack, 1 pack mixes with 16.9oz (500ml) water",breakfast cereal,"[""https://storage.googleapis.com/ef-prod-gather-v2/storage/Amazon-US/resources/detail/2025/05/7545ddcc4f81a6d52e01bf8a5df2e4f2.res"",""https://storage.googleapis.com/ef-prod-gather-v2/storage/Amazon-US/resources/detail/2025/05/00efce75ee8baaf3b87dfda3b5dc05e6.res"",""https://storage.googleapis.com/ef-prod-gather-v2/storage/Amazon-US/resources/detail/2025/05/8e08781afbb7bc40db0b7064baaf7b45.res"",""https://storage.googleapis.com/ef-prod-gather-v2/storage/Amazon-US/resources/detail/2025/05/e80fa32871db6c99d839e61489ea1add.res"",""https://storage.googleapis.com/ef-prod-gather-v2/storage/Amazon-US/resources/detail/2025/05/a46830d78fc112bf831b4cf0e42c9b7c.res"",""https://storage.googleapis.com/ef-prod-gather-v2/storage/Amazon-US/resources/detail/2025/05/6e6cd2399741d657b743ce865195d800.res"",""https://storage.googleapis.com/ef-prod-gather-v2/storage/Amazon-US/resources/detail/2025/05/1cdc55f7b78db7c59b66a7c3ac985446.res"",""https://storage.googleapis.com/ef-prod-gather-v2/storage/Amazon-US/resources/detail/2025/05/311e28948959e4427274104aafbe2d10.res""]","[""Includes 18 sticks of Gatorlyte Rapid Rehydration powder, each stick makes 16.9 oz (500ml) of Gatorlyte: Orange, Cherry Lime, and Watermelon flavors"",""Same great product as Gatorlyte Ready to Drink, but in convenient powder form."",""Scientifically formulated for rapid rehydration to help quickly replace the fluids and electrolytes lost in sweat"",""Specialized blend of 5 electrolytes: Sodium, Potassium, Chloride, Magnesium, and Calcium"",""Made with no artificial sweeteners or flavors"",""Lower Sugar: Made with 60% lower sugar than leading sports drink, Gatorlyte contains 10g total sugars per 16.9 fl oz serving, the leading sports drink contains 32g sugars per 16.9 fl oz serving."",""45 calories per packet""]",11,24,7,13,Health & Household › Diet & Sports Nutrition › Sports Nutrition › Electrolyte Replacements,,Scientifically formulated for rapid rehydration to help quickly replace the fluids and electrolytes lost in sweat. Scientifically formulated for rapid rehydration to help quickly replace the fluids and electrolytes lost in sweat.
B0D4HHQK4J,"Electrolytes Powder Plus (50 Servings), 0 Calorie Keto, 0 Sugar, No Maltodextrin,1000mg Potassium,120mg Calcium,120mg Magnesium, Hydration Powder (50 Servings, Strawberry Cucumber)",snacks & sweets,"[""https://storage.googleapis.com/ef-prod-gather-v2/storage/Amazon-US/resources/detail/2025/05/54c75a63b0ef92d3b840fdc11dbc8763.res"",""https://storage.googleapis.com/ef-prod-gather-v2/storage/Amazon-US/resources/detail/2025/05/82dc51ecba15861106a9d62737fe6c07.res"",""https://storage.googleapis.com/ef-prod-gather-v2/storage/Amazon-US/resources/detail/2025/05/97ebc8734bec178ca6f89eec593b4a51.res"",""https://storage.googleapis.com/ef-prod-gather-v2/storage/Amazon-US/resources/detail/2025/05/571e2b3e552741133ed75cbc407dae69.res"",""https://storage.googleapis.com/ef-prod-gather-v2/storage/Amazon-US/resources/detail/2025/05/2aeafa0359c325b2276fc45d43935428.res"",""https://storage.googleapis.com/ef-prod-gather-v2/storage/Amazon-US/resources/detail/2025/05/a650209869c9aea250c263545ddf0513.res"",""https://storage.googleapis.com/ef-prod-gather-v2/storage/Amazon-US/resources/detail/2025/05/a4d6a212e7b961a5a836996cbd7954df.res"",""https://storage.googleapis.com/ef-prod-gather-v2/storage/Amazon-US/resources/detail/2025/05/39d6e6c2c89db3b9cae6275a5f82d8f1.res""]","[""Electrolyte Powder: Electrolytes Powder Plus contains 1000 mg of potassium opposed to only 250 mg in other brands. Additionally, we offer a unique flavor and blend of Magnesium, Calcium, Pink Himalayan salt. Our delicious and hydrating blend of strawberry cucumber flavor includes 50 servings."",""Easy To Make: By stirring into flat or sparkling water, our sugar-free electrolytes powder serves up 50 20oz of refreshing keto strawberry cucumber per 275g pouch. It is a thirst-quenching recovery drink."",""Electrolyte Water Enhancer: Packs 1000mg potassium, 120mg calcium, 120mg magnesium, organic beets, and organic Vitamin C + zinc into an energy-boosting, hydration drink mix with zero calories or sugar."",""Clean Keto Powder: Contains No maltodextrin, fillers or additives. Enjoy guilt-free, flavorful dehydration relief by naturally replacing electrolytes lost while exercising, traveling or working-out."",""Keep Yourself Hydrated: Without added calories. PowderVitamin Sugar-Free Electrolyte Powder Plus aids in per workout & post workout muscle recovery with potassium and essential mineral salts.""]",,,,,Health & Household › Diet & Sports Nutrition › Sports Nutrition › Electrolyte Replacements,PowderVitamin,"The Key to Keto Success Stay hydrated and ensure proper cell function after a day in the sun or a night on the town. PowderVitamin Electrolytes Powder No-Sugar Drink Mix naturally replaces mineral salts that your body lost while sweating over the lawn mower or partying with friends. This aids in post-workout recovery and promotes nausea and headache relief. Our strawberry cucumber-flavor electrolyte drink mix is a tasty and guilt-free way to stay hydrated and avert dizziness, nausea and other symptoms of keto flu. No Fillers or Additives Our no-sugar electrolyte powder is free of maltodexotrin, a claim that many other electrolyte drinks cannot make. It also contains many key vitamins and minerals so it does the work of a potassium supplement and magnesium supplement. Stabilize daily energy levels, receive important immune support, and stay hydrated for peak physical and mental performance with everything you need and nothing that you don't. Each 275-gram resealable pouch of PowderVitamin Keto Electrolyte Powder makes 50 servings. Made in the USA This electrolytes no-sugar hydration powder is manufactured at FDA-compliant, GMP-certified facilities for your peace of mind. It contains 100-percent clean magnesium citrate, potassium citrate, and organic Vitamin C + zinc, with no artificial flavors, fillers or chemicals. This makes it ideal for occasions when you need fasting electrolytes. Simply stir 1 scoop into water until dissolved and enjoy. Deliciously re-hydrate without calories or sugar. Add PowderVitamin Electrolytes Keto Powder Plus to your keto drinks today."
B0BPN62TJ4,"Propel Fitness Water Tablets, Grape, 10 Count Tube, (Pack of 8)",beverages,"[""https://storage.googleapis.com/ef-prod-gather-v2/storage/Amazon-US/resources/detail/2025/05/0dd4fd3a97c1d4a289a013a5645907c0.res"",""https://storage.googleapis.com/ef-prod-gather-v2/storage/Amazon-US/resources/detail/2025/05/cdabf775dbedd4b63a256dfc2c662041.res"",""https://storage.googleapis.com/ef-prod-gather-v2/storage/Amazon-US/resources/detail/2025/05/884ac236ebc4ecac2692d9e4e88d1895.res"",""https://storage.googleapis.com/ef-prod-gather-v2/storage/Amazon-US/resources/detail/2025/05/5d7dc511538f6b18904417be90204d5f.res"",""https://storage.googleapis.com/ef-prod-gather-v2/storage/Amazon-US/resources/detail/2025/05/66cdc43c666a477b4c750de569b9de07.res"",""https://storage.googleapis.com/ef-prod-gather-v2/storage/Amazon-US/resources/detail/2025/05/66df819ae63ce4f2bcdb21b3ca81869b.res"",""https://storage.googleapis.com/ef-prod-gather-v2/storage/Amazon-US/resources/detail/2025/05/61925159ef4213d44933893563380a3b.res""]","[""Includes 8 (1.5oz) tubes of Propel Tablets, Grape flavor, 10 tablets per tube"",""Drop the Propel Tablet into a refillable water bottle with 15-20oz of water, and let fizz until tablet dissolves1`"",""Contains Gatorade Electrolytes to help replace what you lose in sweat"",""Excellent source of vitamins B3, B5, B6, B12 & E, good source of antioxidant vitamin C"",""Zero sugar and zero calories"",""Made with no artificial flavors or added colors"",""Compact resealable tube to help keep you hydrated on-the-go""]",,,,,Health & Household › Diet & Sports Nutrition › Sports Nutrition › Electrolyte Replacements,,"Propel is a low calorie, zero sugar, fitness water made to replenish and rehydrate active lifestyles. With Gatorade electrolytes, Propel fitness water helps to replace what you lose in sweat. Made with zero sugar, Propel Electrolyte Tablets help you get the most out of your workout and provide an excellent source of vitamins B3, B5, B6, B12 & E as well as a good source of antioxidant vitamin C."
