product_id,title,universe,image_url,bullet_points,min_rank_search,avg_rank_search,min_rank_category,avg_rank_category,retailer_category_node,retailer_brand_name,description_filled
B08YND6YC3,"Electrolyte Packets for Recovery & Hydration | Organic & Sugar-Free Electrolytes Drinks | Works Faster Than Powder Drink | On-The-Go Liquid Hydration Drink | Raspberry, 10 Pack",beverages,"[""https://storage.googleapis.com/ef-prod-gather-v2/storage/Amazon-US/resources/detail/2025/06/82661ef2c932e83d9922d0376d5d7958.res"",""https://storage.googleapis.com/ef-prod-gather-v2/storage/Amazon-US/resources/detail/2025/06/2b0432e0c3c19629d19834244f0c16d2.res"",""https://storage.googleapis.com/ef-prod-gather-v2/storage/Amazon-US/resources/detail/2025/06/4b6199a1c444483037c667b539c8b200.res"",""https://storage.googleapis.com/ef-prod-gather-v2/storage/Amazon-US/resources/detail/2025/06/2466aa865ea49c89f8d7426d68c6f8dd.res"",""https://storage.googleapis.com/ef-prod-gather-v2/storage/Amazon-US/resources/detail/2025/06/a5c7df043d3776d8549974276a359b58.res"",""https://storage.googleapis.com/ef-prod-gather-v2/storage/Amazon-US/resources/detail/2025/06/a956d2a2008e8829ca987ea710997f9b.res"",""https://storage.googleapis.com/ef-prod-gather-v2/storage/Amazon-US/resources/detail/2025/06/957d893ea635eac79aefa97d36a802f3.res"",""https://storage.googleapis.com/ef-prod-gather-v2/storage/Amazon-US/resources/detail/2025/06/ebd3612d8bb25d9bc2ea271608c25651.res""]","[""Fast Recovery & Hydration Boost: Protekt hydration electrolyte packets are designed to help your body recover quickly and stay hydrated after physical exertion. With a unique electrolyte ratio, this sugar free electrolyte drink replenishes essential minerals faster than traditional hydration powder."",""Convenient On-the-Go Liquid Hydration: These liquid hydration packets dissolve easily in water, providing a convenient way to stay hydrated on the move. Perfect for travel or outdoor activities, these liquid electrolytes packets ensure you maintain optimal hydration and performance wherever you are."",""Healthy, Sugar-Free Hydration Packets: Enjoy a pure hydration experience with keto and paleo-friendly electrolyte drinks that are naturally sweetened. These sugar free electrolytes packets are a healthy choice for those looking to stay hydrated without compromising their diet."",""Athlete-Crafted for Peak Performance: Developed by athletes and veterans, Protekt’s electrolytes packets are crafted to enhance outdoor performance. These organic hydration packets are rigorously tested to provide effective hydration solution for peak physical and mental output."",""About the Brand: At Protekt, we prioritize quality and purity in all our products. Each electrolyte drink is designed to give you an edge when it matters most. Our hydration drinks are meticulously crafted with the best ingredients to help you push your limits.""]",,,,,Health & Household › Diet & Sports Nutrition › Sports Nutrition › Electrolyte Replacements,PROTEKT,Electrolyte Packets for Recovery Hydration Organic Sugar-Free Electrolytes Drinks Works Faster Than Powder Drink On-The Go by PROTEKT is designed for everyday use in the Health & Household segment. Suitable for home or on-the-go use; review the product images and information for full specifications and usage guidance.
B0711VBT9M,"BARE PERFORMANCE NUTRITION BPN Electrolytes Go Packs Hydration Drink Mix | Sugar Free Electrolyte Powder | 500mg Sodium per Serving | Naturally Sweetened | Salted Watermelon, 30 Servings",snacks & sweets,"[""https://storage.googleapis.com/ef-prod-gather-v2/storage/Amazon-US/resources/detail/2025/05/fc08a2ab9fe42d65b53fdacb404cd974.res"",""https://storage.googleapis.com/ef-prod-gather-v2/storage/Amazon-US/resources/detail/2025/05/aee327fa74f3e47faee3d59978dfa18b.res"",""https://storage.googleapis.com/ef-prod-gather-v2/storage/Amazon-US/resources/detail/2025/05/cc338bfe09f93991057c2f4814c25fd8.res"",""https://storage.googleapis.com/ef-prod-gather-v2/storage/Amazon-US/resources/detail/2025/05/f9032542140210f2333e28bfa2c04c5f.res"",""https://storage.googleapis.com/ef-prod-gather-v2/storage/Amazon-US/resources/detail/2025/05/70dc26dd3123a35d34565d6f87bc0052.res""]","[""BPN ELECTROLYTES GO PACKS (30 SINGLE SERVING PACKS): Individual servings of our balanced hydration mix, including 500mg sodium to support daily performance and maintain appropriate levels of hydration. Salted Watermelon"",""PRIMARY BENEFITS: Improve daily hydration with a balanced ratio of electrolytes. Improve performance, reduce fatigue, fight dehydration, optimize performance, and improve your daily health goals"",""SUGAR FREE: Naturally sweetened and flavored. 500mg Sodium per serving from Pink Himalayan Salt. Nothing that you don't need, but everything that you do. This supplement does not contain any sugar, and is naturally sweetened and flavored."",""THIRD-PARTY TESTED FOR BANNED SUBSTANCES: Every batch of Informed Sport certified products are tested for prohibited substances ensuring you feel comfortable when consuming the product"",""BARE PERFORMANCE NUTRITION: We are a team of driven leaders who are passionate about helping others reach their highest levels of fitness with training, nutrition, and supplementation. We live and train behind the motto, \""GO ONE MORE\""""]",60,60,,,Health & Household › Diet & Sports Nutrition › Sports Nutrition › Electrolyte Replacements,BARE PERFORMANCE NUTRITION,BARE PERFORMANCE NUTRITION BPN Electrolytes Go Packs Hydration Drink Mix Sugar Free Electrolyte Powder 500mg Sodium is designed for everyday use in the Health & Household segment. Suitable for home or on-the-go use; review the product images and information for full specifications and usage guidance.
B0D1YR8KTF,"Wellah Splish Splash Hydration Electrolyte Drink Mix (Watermelon Flavored, 30 Servings)",beverages,"[""https://storage.googleapis.com/ef-prod-gather-v2/storage/Amazon-US/resources/detail/2025/08/f05b7185181c56fee2d58f973445407e.res"",""https://storage.googleapis.com/ef-prod-gather-v2/storage/Amazon-US/resources/detail/2025/08/7ea16534c1312745ba7d14c11f6d3278.res"",""https://storage.googleapis.com/ef-prod-gather-v2/storage/Amazon-US/resources/detail/2025/08/9dc972b693129d2da44481ed2bfedda0.res"",""https://storage.googleapis.com/ef-prod-gather-v2/storage/Amazon-US/resources/detail/2025/08/6322642e12e1ff9edd78599687970420.res"",""https://storage.googleapis.com/ef-prod-gather-v2/storage/Amazon-US/resources/detail/2025/08/c786a1c3fa4e78e6ecbd00eea99f1161.res""]","[""Refreshing Hydration: Enjoy the delicious taste of Watermelon while replenishing electrolytes lost during exercise or daily activities."",""Electrolyte Replenishment: Wellah's Splish Splash Drink Mix is formulated with a blend of electrolytes to support hydration and maintain electrolyte balance."",""Superfruit Complex: Infused with a superfruit complex, each serving provides additional antioxidants and nutrients for enhanced hydration benefits."",""Convenient Serving Size: With 30 servings per bottle, it's easy to stay hydrated on the go, whether you're at the gym, office, or outdoors."",""Trusted Quality: Manufactured in an NSF Certified GMP Compliant facility and subjected to rigorous third-party testing, Wellah ensures the highest standards of quality and safety in every batch.""]",54,54,3,3,Health & Household › Diet & Sports Nutrition › Sports Nutrition › Electrolyte Replacements,Wellah,"Quench your thirst and replenish electrolytes with Wellah's Splish Splash Hydration Electrolyte Drink Mix in refreshing Watermelon flavor. Crafted with a blend of electrolytes and superfruit complex, each serving revitalizes your body with essential nutrients. With 30 servings per bottle, it's the perfect hydration companion for your active lifestyle. Manufactured in a certified facility and rigorously tested by independent laboratories, you can trust Wellah to deliver quality hydration support."
B00EISFBYA,"LyteShow - Electrolyte Concentrate for Rapid Rehydration - NO Sugars, NO Additives - 40 Servings (with Magnesium, Potassium, Zinc)",beverages,"[""https://storage.googleapis.com/ef-prod-gather-v2/storage/Amazon-US/resources/detail/2025/07/5849493670aa36c5062fa6e2198b18cd.res"",""https://storage.googleapis.com/ef-prod-gather-v2/storage/Amazon-US/resources/detail/2025/07/dc85d2ac7836d3397328c52c6013203b.res"",""https://storage.googleapis.com/ef-prod-gather-v2/storage/Amazon-US/resources/detail/2025/07/40bb1583d4e0dc49a227ef595f796c4f.res"",""https://storage.googleapis.com/ef-prod-gather-v2/storage/Amazon-US/resources/detail/2025/07/468fa1e5ae3b14fb5ddb577d5a152e35.res"",""https://storage.googleapis.com/ef-prod-gather-v2/storage/Amazon-US/resources/detail/2025/07/eb1312736279b78e4e48114bf92f4ef0.res"",""https://storage.googleapis.com/ef-prod-gather-v2/storage/Amazon-US/resources/detail/2025/07/892a22acf13642efc04a12a8f5de28a0.res""]",[],20,40,5,5,Health & Household › Diet & Sports Nutrition › Sports Nutrition › Electrolyte Replacements,LyteLine,LyteShow Electrolyte Concentrate for Rapid Rehydration NO Sugars NO Additives 40 Servings with Magnesium Potassium Zinc by LyteLine is designed for everyday use in the Health & Household segment. Suitable for home or on-the-go use; review the product images and information for full specifications and usage guidance.
B0D4HHQK4J,"Electrolytes Powder Plus (50 Servings), 0 Calorie Keto, 0 Sugar, No Maltodextrin,1000mg Potassium,120mg Calcium,120mg Magnesium, Hydration Powder (50 Servings, Strawberry Cucumber)",beverages,"[""https://storage.googleapis.com/ef-prod-gather-v2/storage/Amazon-US/resources/detail/2025/06/54c75a63b0ef92d3b840fdc11dbc8763.res"",""https://storage.googleapis.com/ef-prod-gather-v2/storage/Amazon-US/resources/detail/2025/06/82dc51ecba15861106a9d62737fe6c07.res"",""https://storage.googleapis.com/ef-prod-gather-v2/storage/Amazon-US/resources/detail/2025/06/97ebc8734bec178ca6f89eec593b4a51.res"",""https://storage.googleapis.com/ef-prod-gather-v2/storage/Amazon-US/resources/detail/2025/06/571e2b3e552741133ed75cbc407dae69.res"",""https://storage.googleapis.com/ef-prod-gather-v2/storage/Amazon-US/resources/detail/2025/06/2aeafa0359c325b2276fc45d43935428.res"",""https://storage.googleapis.com/ef-prod-gather-v2/storage/Amazon-US/resources/detail/2025/06/a650209869c9aea250c263545ddf0513.res"",""https://storage.googleapis.com/ef-prod-gather-v2/storage/Amazon-US/resources/detail/2025/06/a4d6a212e7b961a5a836996cbd7954df.res"",""https://storage.googleapis.com/ef-prod-gather-v2/storage/Amazon-US/resources/detail/2025/06/39d6e6c2c89db3b9cae6275a5f82d8f1.res""]","[""Electrolyte Powder: Electrolytes Powder Plus contains 1000 mg of potassium opposed to only 250 mg in other brands. Additionally, we offer a unique flavor and blend of Magnesium, Calcium, Pink Himalayan salt. Our delicious and hydrating blend of strawberry cucumber flavor includes 50 servings."",""Easy To Make: By stirring into flat or sparkling water, our sugar-free electrolytes powder serves up 50 20oz of refreshing keto strawberry cucumber per 275g pouch. It is a thirst-quenching recovery drink."",""Electrolyte Water Enhancer: Packs 1000mg potassium, 120mg calcium, 120mg magnesium, organic beets, and organic Vitamin C + zinc into an energy-boosting, hydration drink mix with zero calories or sugar."",""Clean Keto Powder: Contains No maltodextrin, fillers or additives. Enjoy guilt-free, flavorful dehydration relief by naturally replacing electrolytes lost while exercising, traveling or working-out."",""Keep Yourself Hydrated: Without added calories. PowderVitamin Sugar-Free Electrolyte Powder Plus aids in per workout & post workout muscle recovery with potassium and essential mineral salts.""]",,,,,Health & Household › Diet & Sports Nutrition › Sports Nutrition › Electrolyte Replacements,PowderVitamin,"The Key to Keto Success Stay hydrated and ensure proper cell function after a day in the sun or a night on the town. PowderVitamin Electrolytes Powder No-Sugar Drink Mix naturally replaces mineral salts that your body lost while sweating over the lawn mower or partying with friends. This aids in post-workout recovery and promotes nausea and headache relief. Our strawberry cucumber-flavor electrolyte drink mix is a tasty and guilt-free way to stay hydrated and avert dizziness, nausea and other symptoms of keto flu. No Fillers or Additives Our no-sugar electrolyte powder is free of maltodexotrin, a claim that many other electrolyte drinks cannot make. It also contains many key vitamins and minerals so it does the work of a potassium supplement and magnesium supplement. Stabilize daily energy levels, receive important immune support, and stay hydrated for peak physical and mental performance with everything you need and nothing that you don't. Each 275-gram resealable pouch of PowderVitamin Keto Electrolyte Powder makes 50 servings. Made in the USA This electrolytes no-sugar hydration powder is manufactured at FDA-compliant, GMP-certified facilities for your peace of mind. It contains 100-percent clean magnesium citrate, potassium citrate, and organic Vitamin C + zinc, with no artificial flavors, fillers or chemicals. This makes it ideal for occasions when you need fasting electrolytes. Simply stir 1 scoop into water until dissolved and enjoy. Deliciously re-hydrate without calories or sugar. Add PowderVitamin Electrolytes Keto Powder Plus to your keto drinks today."
B0013KAPJW,Sqwincher Liquid Concentrate Grape Flavored Low Calorie Low Sodium Electrolyte Replenishment Hydration Drink Mix Makes 5 Gallons of Bevrage 64 Oz (Pack of 6),beverages,"[""https://storage.googleapis.com/ef-prod-gather-v2/storage/Amazon-US/resources/detail/2025/09/58ee6eb1ee306cff3df5cd737b935314.res""]","[""ELECTROLYTE REPLENISHMENT: Each Sqwincher Liquid Concentrate is packed with essential electrolytes like potassium, sodium, and magnesium. Stay hydrated and replenish your body's electrolyte balance with these convenient Fast packs!"",""MOBILE HYDRATION: Sqwincher is your go-to hydration solution, specifically made for those on the move. Regardless of your location and occupation, Sqwincher offers a range of portable options, from powders & drinks to freeze pops. This way you will always have a convenient option to stay hydrated and increase energy with an electrolyte boost!"",""HYDRATION FOR EVERYONE: Sqwincher offers a diverse product line made for you, no matter who you are. Whether you're an athlete, construction worker, or just needing a refreshing boost Sqwincher has you covered. With our extensive variety of flavors and forms, you're guaranteed to find the ideal electrolyte-infused drink, powder, or even freeze pop for you!"",""HEALTHY ALTERNATIVE: Sqwincher is designed for everyone, offering a diverse product line packed with electrolytes. These products provide a balanced blend of minerals to enhance performance and prevent muscle fatigue. All Sqwincher products are gluten-free and low in sodium, making them suitable for those with dietary restrictions. Additionally, Sqwincher offers a variety of products that are zero sugar and low calorie, allowing you to choose based on your specific nutritional needs."",""LIQUID CONCENTRATE: Need to hydrate a large group or team? Simply add bulk concentrate to 5 gallons of water. This product contains 6, 64oz containers of grape flavored liquid concentrate.""]",,,4,17,Health & Household › Diet & Sports Nutrition › Sports Nutrition › Electrolyte Replacements,Sqwincher,"Founded in Columbus, MS, in 1975 Sqwincher has been hydrating hard-working Americans for over 45 years. Our dedication to providing quality hydration products and convenient, innovative and economical packaging made us “The Drink of Industry”. However, we learned from our industrial faithful that no two individuals are alike and everyone needs hydration solutions that fit their unique lifestyle. So whatever lifestyle best describes you: Weekend Warrior, Hardworking American, Trail-blazing Hike-o-Maniac, Dirt Eating Infielder, Heroic Swing Shift Nurse, Wrench Bending Gearhead, 24/7 Super Mom, Outdoor Dweller, Lure Slinging Fish-o-Holic, Outpatient Postop Overachiever, CrossFit Fanatic, Back Breaking Steel Worker – replenish it with Sqwincher. HYDRATE YOUR LIFESTYLE"
B0BPN423GH,"Gatorlyte Rapid Rehydration Electrolyte Beverage, Variety Pack, Lower Sugar, Specialized Blend of 5 Electrolytes, No Artificial Sweeteners or Flavors, 18 pack, 1 pack mixes with 16.9oz (500ml) water",pantry staples,"[""https://storage.googleapis.com/ef-prod-gather-v2/storage/Amazon-US/resources/detail/2025/06/fce0ca5f7af9467a6cf6f0257ec6035a.res"",""https://storage.googleapis.com/ef-prod-gather-v2/storage/Amazon-US/resources/detail/2025/06/311e28948959e4427274104aafbe2d10.res"",""https://storage.googleapis.com/ef-prod-gather-v2/storage/Amazon-US/resources/detail/2025/06/00efce75ee8baaf3b87dfda3b5dc05e6.res"",""https://storage.googleapis.com/ef-prod-gather-v2/storage/Amazon-US/resources/detail/2025/06/8e08781afbb7bc40db0b7064baaf7b45.res"",""https://storage.googleapis.com/ef-prod-gather-v2/storage/Amazon-US/resources/detail/2025/06/e80fa32871db6c99d839e61489ea1add.res"",""https://storage.googleapis.com/ef-prod-gather-v2/storage/Amazon-US/resources/detail/2025/06/a46830d78fc112bf831b4cf0e42c9b7c.res"",""https://storage.googleapis.com/ef-prod-gather-v2/storage/Amazon-US/resources/detail/2025/06/6e6cd2399741d657b743ce865195d800.res"",""https://storage.googleapis.com/ef-prod-gather-v2/storage/Amazon-US/resources/detail/2025/06/1cdc55f7b78db7c59b66a7c3ac985446.res""]","[""Includes 18 sticks of Gatorlyte Rapid Rehydration powder, each stick makes 16.9 oz (500ml) of Gatorlyte: Orange, Cherry Lime, and Watermelon flavors"",""Same great product as Gatorlyte Ready to Drink, but in convenient powder form."",""Scientifically formulated for rapid rehydration to help quickly replace the fluids and electrolytes lost in sweat"",""Specialized blend of 5 electrolytes: Sodium, Potassium, Chloride, Magnesium, and Calcium"",""Made with no artificial sweeteners or flavors"",""Lower Sugar: Made with 60% lower sugar than leading sports drink, Gatorlyte contains 10g total sugars per 16.9 fl oz serving, the leading sports drink contains 32g sugars per 16.9 fl oz serving."",""45 calories per packet""]",11,24,7,13,Health & Household › Diet & Sports Nutrition › Sports Nutrition › Electrolyte Replacements,,Scientifically formulated for rapid rehydration to help quickly replace the fluids and electrolytes lost in sweat.
B0BPN62TJ4,"Propel Fitness Water Tablets, Grape, 10 Count Tube, (Pack of 8)",snacks & sweets,"[""https://storage.googleapis.com/ef-prod-gather-v2/storage/Amazon-US/resources/detail/2025/05/0dd4fd3a97c1d4a289a013a5645907c0.res"",""https://storage.googleapis.com/ef-prod-gather-v2/storage/Amazon-US/resources/detail/2025/05/cdabf775dbedd4b63a256dfc2c662041.res"",""https://storage.googleapis.com/ef-prod-gather-v2/storage/Amazon-US/resources/detail/2025/05/884ac236ebc4ecac2692d9e4e88d1895.res"",""https://storage.googleapis.com/ef-prod-gather-v2/storage/Amazon-US/resources/detail/2025/05/5d7dc511538f6b18904417be90204d5f.res"",""https://storage.googleapis.com/ef-prod-gather-v2/storage/Amazon-US/resources/detail/2025/05/66cdc43c666a477b4c750de569b9de07.res"",""https://storage.googleapis.com/ef-prod-gather-v2/storage/Amazon-US/resources/detail/2025/05/66df819ae63ce4f2bcdb21b3ca81869b.res"",""https://storage.googleapis.com/ef-prod-gather-v2/storage/Amazon-US/resources/detail/2025/05/61925159ef4213d44933893563380a3b.res""]","[""Includes 8 (1.5oz) tubes of Propel Tablets, Grape flavor, 10 tablets per tube"",""Drop the Propel Tablet into a refillable water bottle with 15-20oz of water, and let fizz until tablet dissolves1`"",""Contains Gatorade Electrolytes to help replace what you lose in sweat"",""Excellent source of vitamins B3, B5, B6, B12 & E, good source of antioxidant vitamin C"",""Zero sugar and zero calories"",""Made with no artificial flavors or added colors"",""Compact resealable tube to help keep you hydrated on-the-go""]",,,,,Health & Household › Diet & Sports Nutrition › Sports Nutrition › Electrolyte Replacements,,"Propel is a low calorie, zero sugar, fitness water made to replenish and rehydrate active lifestyles. With Gatorade electrolytes, Propel fitness water helps to replace what you lose in sweat. Made with zero sugar, Propel Electrolyte Tablets help you get the most out of your workout and provide an excellent source of vitamins B3, B5, B6, B12 & E as well as a good source of antioxidant vitamin C."
B0BPN847GJ,"Propel Immune Support Tablets, Orange Raspberry, Makes 16.9oz Fl Oz (Pack of 80)",snacks & sweets,"[""https://storage.googleapis.com/ef-prod-gather-v2/storage/Amazon-Fresh-US/resources/detail/2025/05/201f0d2b4b100c0cc0272ef7dcb5a0dc.res"",""https://storage.googleapis.com/ef-prod-gather-v2/storage/Amazon-Fresh-US/resources/detail/2025/05/cef22fc3f398450cb6f6a143f1e265f8.res"",""https://storage.googleapis.com/ef-prod-gather-v2/storage/Amazon-Fresh-US/resources/detail/2025/05/7b2da10a55e24b3109f1617cc53510a6.res"",""https://storage.googleapis.com/ef-prod-gather-v2/storage/Amazon-Fresh-US/resources/detail/2025/05/c17498a2525417ec4aec795a7cbd2cde.res"",""https://storage.googleapis.com/ef-prod-gather-v2/storage/Amazon-Fresh-US/resources/detail/2025/05/42879a6d08d7d1f50386af21d3dcd792.res"",""https://storage.googleapis.com/ef-prod-gather-v2/storage/Amazon-Fresh-US/resources/detail/2025/05/66df819ae63ce4f2bcdb21b3ca81869b.res""]","[""Contains five 8-count Propel Immune Support Tablets, Orange Raspberry flavor"",""Propel Immune Support Hydration Tablets help support a healthy immune system with 100% of the recommended Daily Value of Vitamin C per tablet, and an excellent source of Zinc. They also contain Vitamins B3, B5 and B6 and a good source of antioxidant Vitamin E."",""Created by the makers of Gatorade, Propel is the only low-calorie, zero sugar fitness water among national enhanced water brands with enough electrolytes to replace what is lost in sweat."",""All Propel products are designed for people with busy, active lifestyles who want a water that is naturally flavored and formulated for fitness and supports hydration."",""Simply drop one tablet into 16.9-fl. oz. of water, let fizz. Drink and hydrate.""]",,,,,,,"Contains five 8-count Propel Immune Support Tablets, Orange Raspberry flavor Propel Immune Support Hydration Tablets help support a healthy immune system with 100% of the recommended Daily Value of Vitamin C per tablet, and an excellent source of Zinc. They also contain Vitamins B3, B5 and B6 and a good source of antioxidant Vitamin E. Created by the makers of Gatorade, Propel is the only low-calorie, zero sugar fitness water among national enhanced water brands with enough electrolytes to replace what is lost in sweat. All Propel products are designed for people with busy, active lifestyles who want a water that is naturally flavored and formulated for fitness and supports hydration. Simply drop one tablet into 16.9-fl. oz. of water, let fizz. Drink and hydrate. Propel Immune Support Tablets, Orange Raspberry, Vitamin C + Zinc, Gatorade Electrolytes, Zero Sugar, Makes 16.9 Fl Oz (Pack of 80). Propel Immune Support Hydration Tablets help support a healthy immune system with 100% of the recommended Daily Value of Vitamin C per tablet, and an excellent source of Zinc. They also contain Vitamins B3, B5 and B6 and a good source of antioxidant Vitamin E."
